{
  "meta": {
    "version": "3.0",
    "schema_version": "3.0",
    "generated": "2025-11-22T14:30:00Z",
    "project": "example-backend",
    "backward_compatible_with": ["2.1", "2.0"]
  },
  "names": [
    "UserService",
    "get_user",
    "create_user",
    "user_id",
    "int",
    "Optional",
    "User",
    "name",
    "str",
    "email",
    "tags",
    "list",
    "Database",
    "database",
    "API_KEY",
    "MAX_RETRIES",
    "db_connection",
    "test_get_user",
    "test_get_user_not_found",
    "logging",
    "Logger"
  ],
  "files": [
    "app/services/user_service.py"
  ],
  "filesizes": [
    2048
  ],
  "modules": [
    [0, 0, -1]
  ],
  "classes": [
    [0, 14, 0, [], [], -1, []]
  ],
  "functions": [
    [1, 25, 0],
    [2, 50, 0],
    [17, 80, 0],
    [18, 88, 0]
  ],
  "parameters": {
    "0": [3],
    "1": [7, 9, 10],
    "2": [],
    "3": []
  },
  "docstrings": [
    [0, "User service with business logic.\n\nParameters\n----------\ndatabase : Database\n    Database connection instance"],
    [1, "Get user by ID.\n\nParameters\n----------\nuser_id : int\n    User identifier\n    \nReturns\n-------\nOptional[User]\n    User object or None"],
    [2, "Create new user.\n\nParameters\n----------\nname : str\n    User name\nemail : str\n    User email\ntags : list, optional\n    User tags (default: [])\n    \nReturns\n-------\nUser\n    Created user"]
  ],
  "imports": [
    [19, 0, 1],
    [5, 0, 2],
    [6, 0, 3],
    [12, 0, 4]
  ],
  "validation": {
    "filehashes": {
      "app/services/user_service.py": "abc123def456..."
    }
  },
  "typehints": {
    "0": {
      "params": [[3, 4]],
      "return": 5
    },
    "1": {
      "params": [[7, 8], [9, 8], [10, 11]],
      "return": 6
    }
  },
  "defaults": {
    "1": [
      [10, 1, 0]
    ]
  },
  "defaultvalues": [
    "[]"
  ],
  "defaultissues": [
    [1, 0, 1]
  ],
  "sqlqueries": [
    [0, 28, 0, 0, 0]
  ],
  "sqlquerytexts": [
    "f\"SELECT * FROM users WHERE id = {user_id}\""
  ],
  "hardcodedsecrets": [
    [0, 9, 0, 14]
  ],
  "loggingusage": {
    "functions_with_logger": [1],
    "try_except_blocks": [
      [0, 0, 27, 0],
      [1, 0, 67, 1]
    ]
  },
  "globalvars": [
    [0, 9, 14, 0],
    [0, 10, 15, 1],
    [0, 12, 16, 0]
  ],
  "classdeps": {
    "0": {
      "init_params": [[13, 12]],
      "internal_creation": []
    }
  },
  "docstringformats": {
    "by_function": {
      "0": 0,
      "1": 0,
      "2": -1,
      "3": -1
    },
    "coverage": {
      "total": 4,
      "with_docstrings": 2,
      "by_format": [2, 0, 0, 0]
    }
  },
  "testcoverage": {
    "0": [2, 3]
  }
}
